HCI sniffer - Bluetooth packet analyzer ver 1.42
device: hci0 snap_len: 1028 filter: 0xffffffffffffffff
> HCI Event: Connect Request (0x04) plen 10
  0000: d7 46 51 75 7e c8 0c 02  58 01                    .FQu~...X.
< HCI Command: Accept Connection Request (0x01|0x0009) plen 7
  0000: d7 46 51 75 7e c8 00                              .FQu~..
> HCI Event: Command Status (0x0f) plen 4
  0000: 00 01 09 04                                       ....
> HCI Event: Role Change (0x12) plen 8
  0000: 00 d7 46 51 75 7e c8 00                           ..FQu~..
> HCI Event: Connect Complete (0x03) plen 11
  0000: 00 29 00 d7 46 51 75 7e  c8 01 00                 .)..FQu~...
< HCI Command: Read Remote Supported Features (0x01|0x001b) plen 2
  0000: 29 00                                             ).
> HCI Event: Page Scan Repetition Mode Change (0x20) plen 7
  0000: d7 46 51 75 7e c8 00                              .FQu~..
> HCI Event: Command Status (0x0f) plen 4
  0000: 00 00 1b 04                                       ....
> ACL data: handle 41 flags 0x02 dlen 10
    L2CAP(s): Info req: type 2
< ACL data: handle 41 flags 0x02 dlen 16
    L2CAP(s): Info rsp: type 2 result 0
      Extended feature mask 0x0080
> HCI Event: Max Slots Change (0x1b) plen 3
  0000: 29 00 05                                          )..
> HCI Event: Number of Completed Packets (0x13) plen 5
  0000: 01 29 00 01 00                                    .)...
> ACL data: handle 41 flags 0x02 dlen 10
    L2CAP(s): Info req: type 3
< ACL data: handle 41 flags 0x02 dlen 20
    L2CAP(s): Info rsp: type 3 result 0
      Unknown (len 8)
> HCI Event: Number of Completed Packets (0x13) plen 5
  0000: 01 29 00 01 00                                    .)...
> ACL data: handle 41 flags 0x02 dlen 12
    L2CAP(s): Connect req: psm 17 scid 0x0040
< ACL data: handle 41 flags 0x02 dlen 16
    L2CAP(s): Connect rsp: dcid 0x0040 scid 0x0040 result 1 status 0
      Connection pending - No futher information available
< ACL data: handle 41 flags 0x02 dlen 10
    L2CAP(s): Info req: type 2
> HCI Event: Number of Completed Packets (0x13) plen 5
  0000: 01 29 00 01 00                                    .)...
> HCI Event: Number of Completed Packets (0x13) plen 5
  0000: 01 29 00 01 00                                    .)...
> ACL data: handle 41 flags 0x02 dlen 16
    L2CAP(s): Info rsp: type 2 result 0
      Extended feature mask 0x0080
< ACL data: handle 41 flags 0x02 dlen 10
    L2CAP(s): Info req: type 3
> HCI Event: Number of Completed Packets (0x13) plen 5
  0000: 01 29 00 01 00                                    .)...
> ACL data: handle 41 flags 0x02 dlen 20
    L2CAP(s): Info rsp: type 3 result 0
      Unknown (len 8)
< ACL data: handle 41 flags 0x02 dlen 16
    L2CAP(s): Connect rsp: dcid 0x0040 scid 0x0040 result 0 status 0
      Connection successful
> HCI Event: Number of Completed Packets (0x13) plen 5
  0000: 01 29 00 01 00                                    .)...
> ACL data: handle 41 flags 0x02 dlen 16
    L2CAP(s): Config req: dcid 0x0040 flags 0x00 clen 4
      MTU 48 
< ACL data: handle 41 flags 0x02 dlen 18
    L2CAP(s): Config rsp: scid 0x0040 flags 0x00 result 0 clen 4
      MTU 48 
< ACL data: handle 41 flags 0x02 dlen 12
    L2CAP(s): Config req: dcid 0x0040 flags 0x00 clen 0
> HCI Event: Command Status (0x0f) plen 4
  0000: 00 01 00 00                                       ....
< HCI Command: Change Connection Packet Type (0x01|0x000f) plen 4
  0000: 29 00 18 cc                                       )...
> HCI Event: Number of Completed Packets (0x13) plen 5
  0000: 01 29 00 01 00                                    .)...
> HCI Event: Number of Completed Packets (0x13) plen 5
  0000: 01 29 00 01 00                                    .)...
> ACL data: handle 41 flags 0x02 dlen 18
    L2CAP(s): Config rsp: scid 0x0040 flags 0x00 result 0 clen 4
      MTU 672 
< ACL data: handle 41 flags 0x02 dlen 5
    L2CAP(d): cid 0x0040 len 1 [psm 17]
      HIDP: Control: Virtual cable unplug
< ACL data: handle 41 flags 0x02 dlen 12
    L2CAP(s): Disconn req: dcid 0x0040 scid 0x0040
> ACL data: handle 41 flags 0x02 dlen 12
    L2CAP(s): Connect req: psm 19 scid 0x0041
< ACL data: handle 41 flags 0x02 dlen 16
    L2CAP(s): Connect rsp: dcid 0x0041 scid 0x0041 result 1 status 2
      Connection pending - Authorization pending
< ACL data: handle 41 flags 0x02 dlen 16
    L2CAP(s): Connect rsp: dcid 0x0041 scid 0x0041 result 0 status 0
      Connection successful
> HCI Event: Number of Completed Packets (0x13) plen 5
  0000: 01 29 00 01 00                                    .)...
> HCI Event: Number of Completed Packets (0x13) plen 5
  0000: 01 29 00 01 00                                    .)...
> HCI Event: Number of Completed Packets (0x13) plen 5
  0000: 01 29 00 01 00                                    .)...
> ACL data: handle 41 flags 0x02 dlen 12
    L2CAP(s): Disconn rsp: dcid 0x0040 scid 0x0040
> HCI Event: Number of Completed Packets (0x13) plen 5
  0000: 01 29 00 01 00                                    .)...
> ACL data: handle 41 flags 0x02 dlen 16
    L2CAP(s): Config req: dcid 0x0041 flags 0x00 clen 4
      MTU 48 
< ACL data: handle 41 flags 0x02 dlen 18
    L2CAP(s): Config rsp: scid 0x0041 flags 0x00 result 0 clen 4
      MTU 48 
< ACL data: handle 41 flags 0x02 dlen 12
    L2CAP(s): Config req: dcid 0x0041 flags 0x00 clen 0
> HCI Event: Number of Completed Packets (0x13) plen 5
  0000: 01 29 00 01 00                                    .)...
> HCI Event: Number of Completed Packets (0x13) plen 5
  0000: 01 29 00 01 00                                    .)...
> HCI Event: Read Remote Supported Features (0x0b) plen 11
  0000: 00 29 00 bf fe 8f fe 9b  ff 79 83                 .).......y.
> HCI Event: Command Status (0x0f) plen 4
  0000: 00 01 0f 04                                       ....
< HCI Command: Remote Name Request (0x01|0x0019) plen 10
  0000: d7 46 51 75 7e c8 02 00  00 00                    .FQu~.....
> HCI Event: Connection Packet Type Changed (0x1d) plen 5
  0000: 00 29 00 18 cc                                    .)...
> HCI Event: Command Status (0x0f) plen 4
  0000: 00 01 19 04                                       ....
> ACL data: handle 41 flags 0x02 dlen 18
    L2CAP(s): Config rsp: scid 0x0041 flags 0x00 result 0 clen 4
      MTU 672 
< ACL data: handle 41 flags 0x02 dlen 12
    L2CAP(s): Disconn req: dcid 0x0041 scid 0x0041
> ACL data: handle 41 flags 0x02 dlen 14
    L2CAP(d): cid 0x0041 len 10 [psm 19]
      HIDP: Data: Input report
      0000: 01 00 00 10 00 00 00 00  00                       .........
> ACL data: handle 41 flags 0x02 dlen 14
    L2CAP(d): cid 0x0041 len 10 [psm 19]
      HIDP: Data: Input report
      0000: 01 00 00 00 00 00 00 00  00                       .........
> HCI Event: Number of Completed Packets (0x13) plen 5
  0000: 01 29 00 01 00                                    .)...
> ACL data: handle 41 flags 0x02 dlen 14
    L2CAP(d): cid 0x0041 len 10 [psm 19]
      HIDP: Data: Input report
      0000: 01 00 00 11 00 00 00 00  00                       .........
> ACL data: handle 41 flags 0x02 dlen 14
    L2CAP(d): cid 0x0041 len 10 [psm 19]
      HIDP: Data: Input report
      0000: 01 00 00 00 00 00 00 00  00                       .........
> ACL data: handle 41 flags 0x02 dlen 14
    L2CAP(d): cid 0x0041 len 10 [psm 19]
      HIDP: Data: Input report
      0000: 01 00 00 12 00 00 00 00  00                       .........
> ACL data: handle 41 flags 0x02 dlen 14
    L2CAP(d): cid 0x0041 len 10 [psm 19]
      HIDP: Data: Input report
      0000: 01 00 00 00 00 00 00 00  00                       .........
> ACL data: handle 41 flags 0x02 dlen 14
    L2CAP(d): cid 0x0041 len 10 [psm 19]
      HIDP: Data: Input report
      0000: 01 00 00 13 00 00 00 00  00                       .........
> ACL data: handle 41 flags 0x02 dlen 14
    L2CAP(d): cid 0x0041 len 10 [psm 19]
      HIDP: Data: Input report
      0000: 01 00 00 00 00 00 00 00  00                       .........
> ACL data: handle 41 flags 0x02 dlen 14
    L2CAP(d): cid 0x0041 len 10 [psm 19]
      HIDP: Data: Input report
      0000: 01 00 00 14 00 00 00 00  00                       .........
> ACL data: handle 41 flags 0x02 dlen 14
    L2CAP(d): cid 0x0041 len 10 [psm 19]
      HIDP: Data: Input report
      0000: 01 00 00 00 00 00 00 00  00                       .........
> ACL data: handle 41 flags 0x02 dlen 14
    L2CAP(d): cid 0x0041 len 10 [psm 19]
      HIDP: Data: Input report
      0000: 01 00 00 15 00 00 00 00  00                       .........
> ACL data: handle 41 flags 0x02 dlen 14
    L2CAP(d): cid 0x0041 len 10 [psm 19]
      HIDP: Data: Input report
      0000: 01 00 00 00 00 00 00 00  00                       .........
> ACL data: handle 41 flags 0x02 dlen 14
    L2CAP(d): cid 0x0041 len 10 [psm 19]
      HIDP: Data: Input report
      0000: 01 00 00 16 00 00 00 00  00                       .........
> ACL data: handle 41 flags 0x02 dlen 14
    L2CAP(d): cid 0x0041 len 10 [psm 19]
      HIDP: Data: Input report
      0000: 01 00 00 00 00 00 00 00  00                       .........
> ACL data: handle 41 flags 0x02 dlen 14
    L2CAP(d): cid 0x0041 len 10 [psm 19]
      HIDP: Data: Input report
      0000: 01 00 00 17 00 00 00 00  00                       .........
> ACL data: handle 41 flags 0x02 dlen 14
    L2CAP(d): cid 0x0041 len 10 [psm 19]
      HIDP: Data: Input report
      0000: 01 00 00 00 00 00 00 00  00                       .........
> ACL data: handle 41 flags 0x02 dlen 14
    L2CAP(d): cid 0x0041 len 10 [psm 19]
      HIDP: Data: Input report
      0000: 01 00 00 18 00 00 00 00  00                       .........
> ACL data: handle 41 flags 0x02 dlen 14
    L2CAP(d): cid 0x0041 len 10 [psm 19]
      HIDP: Data: Input report
      0000: 01 00 00 00 00 00 00 00  00                       .........
> ACL data: handle 41 flags 0x02 dlen 14
    L2CAP(d): cid 0x0041 len 10 [psm 19]
      HIDP: Data: Input report
      0000: 01 00 00 19 00 00 00 00  00                       .........
> ACL data: handle 41 flags 0x02 dlen 14
    L2CAP(d): cid 0x0041 len 10 [psm 19]
      HIDP: Data: Input report
      0000: 01 00 00 00 00 00 00 00  00                       .........
> ACL data: handle 41 flags 0x02 dlen 14
    L2CAP(d): cid 0x0041 len 10 [psm 19]
      HIDP: Data: Input report
      0000: 01 00 00 1a 00 00 00 00  00                       .........
> ACL data: handle 41 flags 0x02 dlen 14
    L2CAP(d): cid 0x0041 len 10 [psm 19]
      HIDP: Data: Input report
      0000: 01 00 00 00 00 00 00 00  00                       .........
> ACL data: handle 41 flags 0x02 dlen 14
    L2CAP(d): cid 0x0041 len 10 [psm 19]
      HIDP: Data: Input report
      0000: 01 00 00 1b 00 00 00 00  00                       .........
> ACL data: handle 41 flags 0x02 dlen 14
    L2CAP(d): cid 0x0041 len 10 [psm 19]
      HIDP: Data: Input report
      0000: 01 00 00 00 00 00 00 00  00                       .........
> ACL data: handle 41 flags 0x02 dlen 14
    L2CAP(d): cid 0x0041 len 10 [psm 19]
      HIDP: Data: Input report
      0000: 01 00 00 1c 00 00 00 00  00                       .........
> ACL data: handle 41 flags 0x02 dlen 14
    L2CAP(d): cid 0x0041 len 10 [psm 19]
      HIDP: Data: Input report
      0000: 01 00 00 00 00 00 00 00  00                       .........
> ACL data: handle 41 flags 0x02 dlen 14
    L2CAP(d): cid 0x0041 len 10 [psm 19]
      HIDP: Data: Input report
      0000: 01 00 00 1d 00 00 00 00  00                       .........
> ACL data: handle 41 flags 0x02 dlen 14
    L2CAP(d): cid 0x0041 len 10 [psm 19]
      HIDP: Data: Input report
      0000: 01 00 00 00 00 00 00 00  00                       .........
> ACL data: handle 41 flags 0x02 dlen 14
    L2CAP(d): cid 0x0041 len 10 [psm 19]
      HIDP: Data: Input report
      0000: 01 00 00 1e 00 00 00 00  00                       .........
> ACL data: handle 41 flags 0x02 dlen 14
    L2CAP(d): cid 0x0041 len 10 [psm 19]
      HIDP: Data: Input report
      0000: 01 00 00 00 00 00 00 00  00                       .........
> ACL data: handle 41 flags 0x02 dlen 14
    L2CAP(d): cid 0x0041 len 10 [psm 19]
      HIDP: Data: Input report
      0000: 01 00 00 1f 00 00 00 00  00                       .........
> ACL data: handle 41 flags 0x02 dlen 14
    L2CAP(d): cid 0x0041 len 10 [psm 19]
      HIDP: Data: Input report
      0000: 01 00 00 00 00 00 00 00  00                       .........
> ACL data: handle 41 flags 0x02 dlen 14
    L2CAP(d): cid 0x0041 len 10 [psm 19]
      HIDP: Data: Input report
      0000: 01 00 00 20 00 00 00 00  00                       ... .....
> ACL data: handle 41 flags 0x02 dlen 14
    L2CAP(d): cid 0x0041 len 10 [psm 19]
      HIDP: Data: Input report
      0000: 01 00 00 00 00 00 00 00  00                       .........
> ACL data: handle 41 flags 0x02 dlen 14
    L2CAP(d): cid 0x0041 len 10 [psm 19]
      HIDP: Data: Input report
      0000: 01 00 00 21 00 00 00 00  00                       ...!.....
> ACL data: handle 41 flags 0x02 dlen 14
    L2CAP(d): cid 0x0041 len 10 [psm 19]
      HIDP: Data: Input report
      0000: 01 00 00 00 00 00 00 00  00                       .........
> ACL data: handle 41 flags 0x02 dlen 14
    L2CAP(d): cid 0x0041 len 10 [psm 19]
      HIDP: Data: Input report
      0000: 01 00 00 22 00 00 00 00  00                       ...".....
> ACL data: handle 41 flags 0x02 dlen 14
    L2CAP(d): cid 0x0041 len 10 [psm 19]
      HIDP: Data: Input report
      0000: 01 00 00 00 00 00 00 00  00                       .........
> ACL data: handle 41 flags 0x02 dlen 14
    L2CAP(d): cid 0x0041 len 10 [psm 19]
      HIDP: Data: Input report
      0000: 01 00 00 23 00 00 00 00  00                       ...#.....
> ACL data: handle 41 flags 0x02 dlen 14
    L2CAP(d): cid 0x0041 len 10 [psm 19]
      HIDP: Data: Input report
      0000: 01 00 00 00 00 00 00 00  00                       .........
> ACL data: handle 41 flags 0x02 dlen 14
    L2CAP(d): cid 0x0041 len 10 [psm 19]
      HIDP: Data: Input report
      0000: 01 00 00 24 00 00 00 00  00                       ...$.....
> ACL data: handle 41 flags 0x02 dlen 14
    L2CAP(d): cid 0x0041 len 10 [psm 19]
      HIDP: Data: Input report
      0000: 01 00 00 00 00 00 00 00  00                       .........
> ACL data: handle 41 flags 0x02 dlen 14
    L2CAP(d): cid 0x0041 len 10 [psm 19]
      HIDP: Data: Input report
      0000: 01 00 00 25 00 00 00 00  00                       ...%.....
> ACL data: handle 41 flags 0x02 dlen 14
    L2CAP(d): cid 0x0041 len 10 [psm 19]
      HIDP: Data: Input report
      0000: 01 00 00 00 00 00 00 00  00                       .........
> ACL data: handle 41 flags 0x02 dlen 14
    L2CAP(d): cid 0x0041 len 10 [psm 19]
      HIDP: Data: Input report
      0000: 01 00 00 26 00 00 00 00  00                       ...&.....
> ACL data: handle 41 flags 0x02 dlen 14
    L2CAP(d): cid 0x0041 len 10 [psm 19]
      HIDP: Data: Input report
      0000: 01 00 00 00 00 00 00 00  00                       .........
> ACL data: handle 41 flags 0x02 dlen 14
    L2CAP(d): cid 0x0041 len 10 [psm 19]
      HIDP: Data: Input report
      0000: 01 00 00 27 00 00 00 00  00                       ...'.....
> ACL data: handle 41 flags 0x02 dlen 14
    L2CAP(d): cid 0x0041 len 10 [psm 19]
      HIDP: Data: Input report
      0000: 01 00 00 00 00 00 00 00  00                       .........
> ACL data: handle 41 flags 0x02 dlen 14
    L2CAP(d): cid 0x0041 len 10 [psm 19]
      HIDP: Data: Input report
      0000: 01 00 00 28 00 00 00 00  00                       ...(.....
> ACL data: handle 41 flags 0x02 dlen 14
    L2CAP(d): cid 0x0041 len 10 [psm 19]
      HIDP: Data: Input report
      0000: 01 00 00 00 00 00 00 00  00                       .........
> ACL data: handle 41 flags 0x02 dlen 14
    L2CAP(d): cid 0x0041 len 10 [psm 19]
      HIDP: Data: Input report
      0000: 01 00 00 29 00 00 00 00  00                       ...).....
> ACL data: handle 41 flags 0x02 dlen 14
    L2CAP(d): cid 0x0041 len 10 [psm 19]
      HIDP: Data: Input report
      0000: 01 00 00 00 00 00 00 00  00                       .........
> ACL data: handle 41 flags 0x02 dlen 14
    L2CAP(d): cid 0x0041 len 10 [psm 19]
      HIDP: Data: Input report
      0000: 01 00 00 2a 00 00 00 00  00                       ...*.....
> ACL data: handle 41 flags 0x02 dlen 14
    L2CAP(d): cid 0x0041 len 10 [psm 19]
      HIDP: Data: Input report
      0000: 01 00 00 00 00 00 00 00  00                       .........
> ACL data: handle 41 flags 0x02 dlen 14
    L2CAP(d): cid 0x0041 len 10 [psm 19]
      HIDP: Data: Input report
      0000: 01 00 00 2b 00 00 00 00  00                       ...+.....
> ACL data: handle 41 flags 0x02 dlen 14
    L2CAP(d): cid 0x0041 len 10 [psm 19]
      HIDP: Data: Input report
      0000: 01 00 00 00 00 00 00 00  00                       .........
> ACL data: handle 41 flags 0x02 dlen 14
    L2CAP(d): cid 0x0041 len 10 [psm 19]
      HIDP: Data: Input report
      0000: 01 00 00 2c 00 00 00 00  00                       ...,.....
> ACL data: handle 41 flags 0x02 dlen 14
    L2CAP(d): cid 0x0041 len 10 [psm 19]
      HIDP: Data: Input report
      0000: 01 00 00 00 00 00 00 00  00                       .........
> ACL data: handle 41 flags 0x02 dlen 14
    L2CAP(d): cid 0x0041 len 10 [psm 19]
      HIDP: Data: Input report
      0000: 01 00 00 2d 00 00 00 00  00                       ...-.....
> ACL data: handle 41 flags 0x02 dlen 14
    L2CAP(d): cid 0x0041 len 10 [psm 19]
      HIDP: Data: Input report
      0000: 01 00 00 00 00 00 00 00  00                       .........
> ACL data: handle 41 flags 0x02 dlen 14
    L2CAP(d): cid 0x0041 len 10 [psm 19]
      HIDP: Data: Input report
      0000: 01 00 00 2e 00 00 00 00  00                       .........
> ACL data: handle 41 flags 0x02 dlen 14
    L2CAP(d): cid 0x0041 len 10 [psm 19]
      HIDP: Data: Input report
      0000: 01 00 00 00 00 00 00 00  00                       .........
> ACL data: handle 41 flags 0x02 dlen 14
    L2CAP(d): cid 0x0041 len 10 [psm 19]
      HIDP: Data: Input report
      0000: 01 00 00 2f 00 00 00 00  00                       .../.....
> ACL data: handle 41 flags 0x02 dlen 14
    L2CAP(d): cid 0x0041 len 10 [psm 19]
      HIDP: Data: Input report
      0000: 01 00 00 00 00 00 00 00  00                       .........
> ACL data: handle 41 flags 0x02 dlen 14
    L2CAP(d): cid 0x0041 len 10 [psm 19]
      HIDP: Data: Input report
      0000: 01 00 00 30 00 00 00 00  00                       ...0.....
> ACL data: handle 41 flags 0x02 dlen 14
    L2CAP(d): cid 0x0041 len 10 [psm 19]
      HIDP: Data: Input report
      0000: 01 00 00 00 00 00 00 00  00                       .........
> ACL data: handle 41 flags 0x02 dlen 14
    L2CAP(d): cid 0x0041 len 10 [psm 19]
      HIDP: Data: Input report
      0000: 01 00 00 31 00 00 00 00  00                       ...1.....
> ACL data: handle 41 flags 0x02 dlen 14
    L2CAP(d): cid 0x0041 len 10 [psm 19]
      HIDP: Data: Input report
      0000: 01 00 00 00 00 00 00 00  00                       .........
> ACL data: handle 41 flags 0x02 dlen 14
    L2CAP(d): cid 0x0041 len 10 [psm 19]
      HIDP: Data: Input report
      0000: 01 00 00 32 00 00 00 00  00                       ...2.....
> ACL data: handle 41 flags 0x02 dlen 14
    L2CAP(d): cid 0x0041 len 10 [psm 19]
      HIDP: Data: Input report
      0000: 01 00 00 00 00 00 00 00  00                       .........
> ACL data: handle 41 flags 0x02 dlen 14
    L2CAP(d): cid 0x0041 len 10 [psm 19]
      HIDP: Data: Input report
      0000: 01 00 00 33 00 00 00 00  00                       ...3.....
> ACL data: handle 41 flags 0x02 dlen 14
    L2CAP(d): cid 0x0041 len 10 [psm 19]
      HIDP: Data: Input report
      0000: 01 00 00 00 00 00 00 00  00                       .........
> ACL data: handle 41 flags 0x02 dlen 14
    L2CAP(d): cid 0x0041 len 10 [psm 19]
      HIDP: Data: Input report
      0000: 01 00 00 34 00 00 00 00  00                       ...4.....
> ACL data: handle 41 flags 0x02 dlen 14
    L2CAP(d): cid 0x0041 len 10 [psm 19]
      HIDP: Data: Input report
      0000: 01 00 00 00 00 00 00 00  00                       .........
> ACL data: handle 41 flags 0x02 dlen 14
    L2CAP(d): cid 0x0041 len 10 [psm 19]
      HIDP: Data: Input report
      0000: 01 00 00 35 00 00 00 00  00                       ...5.....
> ACL data: handle 41 flags 0x02 dlen 14
    L2CAP(d): cid 0x0041 len 10 [psm 19]
      HIDP: Data: Input report
      0000: 01 00 00 00 00 00 00 00  00                       .........
> ACL data: handle 41 flags 0x02 dlen 14
    L2CAP(d): cid 0x0041 len 10 [psm 19]
      HIDP: Data: Input report
      0000: 01 00 00 36 00 00 00 00  00                       ...6.....
> ACL data: handle 41 flags 0x02 dlen 14
    L2CAP(d): cid 0x0041 len 10 [psm 19]
      HIDP: Data: Input report
      0000: 01 00 00 00 00 00 00 00  00                       .........
> ACL data: handle 41 flags 0x02 dlen 14
    L2CAP(d): cid 0x0041 len 10 [psm 19]
      HIDP: Data: Input report
      0000: 01 00 00 37 00 00 00 00  00                       ...7.....
> ACL data: handle 41 flags 0x02 dlen 14
    L2CAP(d): cid 0x0041 len 10 [psm 19]
      HIDP: Data: Input report
      0000: 01 00 00 00 00 00 00 00  00                       .........
> ACL data: handle 41 flags 0x02 dlen 14
    L2CAP(d): cid 0x0041 len 10 [psm 19]
      HIDP: Data: Input report
      0000: 01 00 00 38 00 00 00 00  00                       ...8.....
> ACL data: handle 41 flags 0x02 dlen 14
    L2CAP(d): cid 0x0041 len 10 [psm 19]
      HIDP: Data: Input report
      0000: 01 00 00 00 00 00 00 00  00                       .........
> ACL data: handle 41 flags 0x02 dlen 14
    L2CAP(d): cid 0x0041 len 10 [psm 19]
      HIDP: Data: Input report
      0000: 01 00 00 39 00 00 00 00  00                       ...9.....
> ACL data: handle 41 flags 0x02 dlen 14
    L2CAP(d): cid 0x0041 len 10 [psm 19]
      HIDP: Data: Input report
      0000: 01 00 00 00 00 00 00 00  00                       .........
> ACL data: handle 41 flags 0x02 dlen 14
    L2CAP(d): cid 0x0041 len 10 [psm 19]
      HIDP: Data: Input report
      0000: 01 00 00 3a 00 00 00 00  00                       ...:.....
> ACL data: handle 41 flags 0x02 dlen 14
    L2CAP(d): cid 0x0041 len 10 [psm 19]
      HIDP: Data: Input report
      0000: 01 00 00 00 00 00 00 00  00                       .........
> ACL data: handle 41 flags 0x02 dlen 14
    L2CAP(d): cid 0x0041 len 10 [psm 19]
      HIDP: Data: Input report
      0000: 01 00 00 3b 00 00 00 00  00                       ...;.....
> ACL data: handle 41 flags 0x02 dlen 14
    L2CAP(d): cid 0x0041 len 10 [psm 19]
      HIDP: Data: Input report
      0000: 01 00 00 00 00 00 00 00  00                       .........
> ACL data: handle 41 flags 0x02 dlen 14
    L2CAP(d): cid 0x0041 len 10 [psm 19]
      HIDP: Data: Input report
      0000: 01 00 00 3c 00 00 00 00  00                       ...<.....
> ACL data: handle 41 flags 0x02 dlen 14
    L2CAP(d): cid 0x0041 len 10 [psm 19]
      HIDP: Data: Input report
      0000: 01 00 00 00 00 00 00 00  00                       .........
> ACL data: handle 41 flags 0x02 dlen 14
    L2CAP(d): cid 0x0041 len 10 [psm 19]
      HIDP: Data: Input report
      0000: 01 00 00 3d 00 00 00 00  00                       ...=.....
> ACL data: handle 41 flags 0x02 dlen 14
    L2CAP(d): cid 0x0041 len 10 [psm 19]
      HIDP: Data: Input report
      0000: 01 00 00 00 00 00 00 00  00                       .........
> ACL data: handle 41 flags 0x02 dlen 14
    L2CAP(d): cid 0x0041 len 10 [psm 19]
      HIDP: Data: Input report
      0000: 01 00 00 3e 00 00 00 00  00                       ...>.....
> ACL data: handle 41 flags 0x02 dlen 14
    L2CAP(d): cid 0x0041 len 10 [psm 19]
      HIDP: Data: Input report
      0000: 01 00 00 00 00 00 00 00  00                       .........
> ACL data: handle 41 flags 0x02 dlen 14
    L2CAP(d): cid 0x0041 len 10 [psm 19]
      HIDP: Data: Input report
      0000: 01 00 00 3f 00 00 00 00  00                       ...?.....
> ACL data: handle 41 flags 0x02 dlen 14
    L2CAP(d): cid 0x0041 len 10 [psm 19]
      HIDP: Data: Input report
      0000: 01 00 00 00 00 00 00 00  00                       .........
> ACL data: handle 41 flags 0x02 dlen 14
    L2CAP(d): cid 0x0041 len 10 [psm 19]
      HIDP: Data: Input report
      0000: 01 00 00 40 00 00 00 00  00                       ...@.....
> ACL data: handle 41 flags 0x02 dlen 14
    L2CAP(d): cid 0x0041 len 10 [psm 19]
      HIDP: Data: Input report
      0000: 01 00 00 00 00 00 00 00  00                       .........
> ACL data: handle 41 flags 0x02 dlen 14
    L2CAP(d): cid 0x0041 len 10 [psm 19]
      HIDP: Data: Input report
      0000: 01 00 00 41 00 00 00 00  00                       ...A.....
> ACL data: handle 41 flags 0x02 dlen 14
    L2CAP(d): cid 0x0041 len 10 [psm 19]
      HIDP: Data: Input report
      0000: 01 00 00 00 00 00 00 00  00                       .........
> ACL data: handle 41 flags 0x02 dlen 14
    L2CAP(d): cid 0x0041 len 10 [psm 19]
      HIDP: Data: Input report
      0000: 01 00 00 42 00 00 00 00  00                       ...B.....
> ACL data: handle 41 flags 0x02 dlen 14
    L2CAP(d): cid 0x0041 len 10 [psm 19]
      HIDP: Data: Input report
      0000: 01 00 00 00 00 00 00 00  00                       .........
> ACL data: handle 41 flags 0x02 dlen 14
    L2CAP(d): cid 0x0041 len 10 [psm 19]
      HIDP: Data: Input report
      0000: 01 00 00 43 00 00 00 00  00                       ...C.....
> ACL data: handle 41 flags 0x02 dlen 12
    L2CAP(s): Disconn rsp: dcid 0x0041 scid 0x0041
> HCI Event: Remote Name Req Complete (0x07) plen 255
  0000: 00 d7 46 51 75 7e c8 68  65 6c 6c 62 6f 79 73 5f  ..FQu~.hellboys_
  0010: 61 6e 64 72 6f 69 64 00  00 00 00 00 00 00 00 00  android.........
  0020: 00 00 00 00 00 00 00 00  00 00 00 00 00 00 00 00  ................
  0030: 00 00 00 00 00 00 00 00  00 00 00 00 00 00 00 00  ................
  0040: 00 00 00 00 00 00 00 00  00 00 00 00 00 00 00 00  ................
  0050: 00 00 00 00 00 00 00 00  00 00 00 00 00 00 00 00  ................
  0060: 00 00 00 00 00 00 00 00  00 00 00 00 00 00 00 00  ................
  0070: 00 00 00 00 00 00 00 00  00 00 00 00 00 00 00 00  ................
  0080: 00 00 00 00 00 00 00 00  00 00 00 00 00 00 00 00  ................
  0090: 00 00 00 00 00 00 00 00  00 00 00 00 00 00 00 00  ................
  00a0: 00 00 00 00 00 00 00 00  00 00 00 00 00 00 00 00  ................
  00b0: 00 00 00 00 00 00 00 00  00 00 00 00 00 00 00 00  ................
  00c0: 00 00 00 00 00 00 00 00  00 00 00 00 00 00 00 00  ................
  00d0: 00 00 00 00 00 00 00 00  00 00 00 00 00 00 00 00  ................
  00e0: 00 00 00 00 00 00 00 00  00 00 00 00 00 00 00 00  ................
  00f0: 00 00 00 00 00 00 00 00  00 00 00 00 00 00 00     ...............
> HCI Event: Disconn Complete (0x05) plen 4
  0000: 00 29 00 13                                       .)..
